<?xml version="1.0" encoding="UTF-8"?>
<!DOCTYPE cd SYSTEM "cd.dtd">
<cd titulo="titulocd">
<songs>
<cancion duracion="4:47" anio="2008">
<fecha dia="3" mes="5" anio="2008"></fecha>
  <titulo>Give it 2 me</titulo>    
  <compositores>
    <compositor>
        <nombre>Pharrell</nombre>    
        <apellidos>Williams</apellidos>
    </compositor>
  </compositores>
<productores>
    <productor>
        <nombre>Pharrell</nombre>  
        <apellidos>Williams</apellidos>  
    </productor>
</productores>
<sello>Warnes Bros</sello>
<artista>Madonna</artista>

</cancion>

</songs>



</cd>
